PuzzleId,FEN,Moves,Rating,Themes,SAN
0P1vH,5k2/1br3p1/4p1R1/3pqp2/1pp5/4P3/PPB5/1K5Q b - - 0 32,e5e3 h1h8 f8e7 g6g7 e7d6 h8d8 d6e5 d8c7,1972,crushing deflection endgame interference verylong,Qxe3 Qh8+ Ke7 Rxg7+ Kd6 Qd8+ Ke5 Qxc7+
0DqSn,4Rr1k/b5pp/p1q2p2/1p6/1P3P2/PB6/1B2QnPP/4R2K w - - 1 30,h1g1 f2e4 g1f1 f8e8,1981,advantage discoveredattack interference middlegame short,Kg1 Ne4+ Kf1 Rxe8
0R4R5,8/5pNk/3p2rp/1pp1n3/3pP3/1P5q/P2Q1RP1/4R1K1 w - - 0 32,g7f5 g6g2 f2g2 e5f3 g1f2 f3d2,1994,crushing fork interference long middlegame sacrifice,Nf5 Rxg2+ Rxg2 Nf3+ Kf2 Nxd2
00Yuf,5rk1/n1q2ppp/1p1bpn2/1B1p1b2/NP1P4/P3PN2/3B1PPP/3Q1RK1 w - - 0 19,b5e2 f5c2 d1a1 c2a4,1994,advantage interference middlegame short,Be2 Bc2 Qa1 Bxa4
0PG0S,rnbqk2r/1p1p1pQp/p3p3/8/3N4/P1n5/1PP2PPP/R3KB1R b KQkq - 0 10,e8e7 d4f5 e6f5 g7e5 e7f8 e5h8,2000,crushing fork interference long opening sacrifice,Ke7 Nf5+ exf5 Qe5+ Kf8 Qxh8+
0Qt5o,3rr1k1/pb3q2/1pn5/2p2B2/P1Ppp3/3P3Q/1P5K/R2R4 b - - 1 35,c6e5 d1g1 g8f8 h3h8 f8e7 h8e5,2015,advantage exposedking interference kingsideattack long master middlegame,Ne5 Rg1+ Kf8 Qh8+ Ke7 Qxe5+
0SAtB,Nr6/6p1/2pk1pp1/4p1P1/3pP2K/3P3P/2p2PB1/R7 w - - 0 50,g5f6 b8b1 f6f7 d6e7 a1a7 e7f8 a8c7 f8f7,2022,advantage defensivemove endgame interference verylong,gxf6 Rb1 f7 Ke7 Ra7+ Kf8 Nc7 Kxf7
0EO68,2r1k2r/5pp1/p3p2p/6q1/PpnPP3/3Q4/1PB2P1P/1R3R1K b k - 2 21,c4d2 f2f4 g5f6 d3d2,2033,crushing interference master mastervsmaster middlegame short,Nd2 f4 Qf6 Qxd2
0mBZq,1k3nnr/ppq1bbpp/2p5/2P1NB2/8/7P/PP1Q1PP1/R3R1K1 b - - 1 20,g8h6 e5d7 f8d7 e1e7,2039,crushing discoveredattack interference middlegame short,Nh6 Nd7+ Nxd7 Rxe7
0bBiZ,2kr2r1/1pp1qp1p/p1p1bp2/8/8/1P2P3/PBPP2PP/R2Q1RK1 w - - 2 15,b2f6 g8g2 g1g2 d8g8 g2f2 e7f6 d1f3 f6h4 f2e2 e6g4,2046,attraction crushing interference kingsideattack middlegame pin sacrifice verylong,Bxf6 Rxg2+ Kxg2 Rg8+ Kf2 Qxf6+ Qf3 Qh4+ Ke2 Bg4
0nRCv,Q4rk1/2pnppbp/p4np1/1p2q3/8/1B1P4/PPP3PP/RNB2R1K w - - 1 14,a8a6 f6g4 c1f4 g4f2 h1g1 e5f4,2055,advantage interference kingsideattack long middlegame,Qxa6 Ng4 Bf4 Nf2+ Kg1 Qxf4
0pe0C,5k1r/3Q1pp1/8/3pq3/6Pp/5P2/PP3K2/3R4 b - - 3 35,f8g8 d7d8 g8h7 d8h4 h7g6 h4h8,2058,crushing deflection endgame interference long skewer,Kg8 Qd8+ Kh7 Qxh4+ Kg6 Qxh8
0KLkD,r1bqkb1r/pp1n2pp/2n1p3/3pP1pQ/3P4/8/PPB2PPP/RNB1K2R b KQkq - 1 10,g7g6 c2g6 h7g6 h5g6 e8e7 c1g5,2066,crushing exposedking interference long opening,g6 Bxg6+ hxg6 Qxg6+ Ke7 Bxg5+
06fXM,6k1/pp4pp/4p3/3p4/3P2Q1/1P5P/P1q1KPP1/8 w - - 1 25,e2f3 c2d3 f3f4 d3d4,2081,crushing endgame interference queenendgame short,Kf3 Qd3+ Kf4 Qxd4+
0Cyei,r1bq2k1/pp3pp1/1b3n1p/3pr2P/5P1B/P1NB4/1PP3P1/R2Q1RK1 w - - 1 17,g1h1 f6g4 g2g3 e5h5,2097,crushing interference middlegame pin quietmove short,Kh1 Ng4 g3 Rxh5
09lOk,Q7/5pk1/B3p1p1/2p5/4P2K/P4P2/1P4qP/8 w - - 0 38,a8b8 g6g5 h4h5 g2h3 h5g5 f7f6 g5f4 h3h2 f4e3 h2b8,2109,crushing endgame interference master skewer verylong,Qb8 g5+ Kh5 Qh3+ Kxg5 f6+ Kf4 Qxh2+ Ke3 Qxb8
0n8Mj,2kr4/2p3p1/p3bp2/3p3p/P2P4/2PN3P/1Q3PPq/1R3K2 b - - 2 26,e6f5 b2b7 c8d7 b7d5,2109,crushing endgame interference queensideattack short,Bf5 Qb7+ Kd7 Qxd5+
0e7Xx,r5rk/1b5p/pp3P2/2p4B/4p2Q/2PpP3/qP3P1P/2KR2R1 w - - 0 25,f6f7 a2a1 c1d2 a1b2 d2e1 g8g1,2115,deflection interference long mate matein3 middlegame queensideattack,f7 Qa1+ Kd2 Qxb2+ Ke1 Rxg1#
0WK0I,r6k/2p1q2r/p7/3P1Q2/1p2P3/8/PPP1N3/2K3R1 b - - 1 27,a8f8 e2f4 f8f5 f4g6 h8g7 g6e7 f5g5 g1g5,2123,crushing discoveredattack endgame exposedking fork interference quietmove sacrifice verylong,Rf8 Nf4 Rxf5 Ng6+ Kg7 Nxe7+ Rg5 Rxg5+
0KXou,r6r/pk1p1p2/b1pq3p/Q5p1/8/6P1/2P2KBP/1R6 b - - 11 28,a6b5 a5b5 b7c7 b5b7 c7d8 b7a8,2132,crushing interference long middlegame pin,Bb5 Qxb5+ Kc7 Qb7+ Kd8 Qxa8+
0h7mm,r2q1k2/1p3Bpp/1p6/4N3/1p2bPP1/1P5P/PQ5R/K7 w - - 1 31,b2d2 a8a2 d2a2 d8d1 a1b2 d1d4 b2c1 d4g1 c1d2 g1h2 d2e3 h2a2,2144,crushing interference middlegame sacrifice skewer verylong,Qd2 Rxa2+ Qxa2 Qd1+ Kb2 Qd4+ Kc1 Qg1+ Kd2 Qxh2+ Ke3 Qxa2
0Qrax,7k/pp1R4/5q1p/2Q3p1/8/4p1P1/PP5P/2R2K2 w - - 1 33,f1e1 f6f2 e1d1 e3e2 d1c2 f2c5,2149,advancedpawn crushing discoveredattack endgame exposedking interference long,Ke1 Qf2+ Kd1 e2+ Kc2 Qxc5+
08ct3,7k/p5p1/1b5p/P4Q1P/1P1P4/1q1K4/5P2/6R1 w - - 1 45,d3e4 b3c2 e4f4 c2f2 f4g4 f2g1,2150,crushing endgame fork interference long,Ke4 Qc2+ Kf4 Qxf2+ Kg4 Qxg1+
0A0jY,rqb1k2r/3p2p1/p3pp2/1p3P1p/4P1n1/P1N4P/BP2Q1P1/2R2R1K w kq - 1 20,h3g4 h5g4 h1g1 b8h2 g1f2 h2f4 f2e1 f4c1,2157,crushing discoveredattack interference kingsideattack middlegame verylong,hxg4 hxg4+ Kg1 Qh2+ Kf2 Qf4+ Ke1 Qxc1+
0ojI0,4k2r/1p2pp1p/p1q3p1/P2R4/5B2/3Q4/1b3PPP/6K1 b k - 2 27,e7e6 d5d8 e8e7 f4g5 f7f6 d8h8,2165,crushing endgame interference long,e6 Rd8+ Ke7 Bg5+ f6 Rxh8
0VCFR,r3r1k1/6p1/1p3p2/pNp1p1q1/P3Q3/1P1P1K2/2P2P2/7R b - - 5 35,f6f5 e4d5 g8f8 h1h8 f8e7 d5e5,2171,crushing endgame interference long,f5 Qd5+ Kf8 Rh8+ Ke7 Qxe5+
0Hl1I,r1b2r1k/2q3p1/p2b4/8/4QpP1/5N1P/PPP5/2KR2R1 w - - 0 25,e4a8 c8b7 a8a7 b7f3 a7c7 d6c7,2174,advantage interference long middlegame,Qxa8 Bb7 Qa7 Bxf3 Qxc7 Bxc7
0JoJB,5r1k/p1p4p/Q1nq1pp1/5b2/2BP4/4P3/Pr1N1PPP/R4RK1 w - - 3 19,d2f3 b2b6 a6a4 b6b4 a4d1 b4c4,2181,advantage interference long middlegame,Nf3 Rb6 Qa4 Rb4 Qd1 Rxc4
0MbPR,r3rk2/2p2ppQ/pp6/2p1P1q1/P7/1P3P2/2P2P1P/R4R1K b - - 2 23,g5e5 a1e1 e5e1 h7h8 f8e7 f1e1,2183,crushing endgame interference intermezzo long sacrifice,Qxe5 Rae1 Qxe1 Qh8+ Ke7 Rxe1+
0Qxtn,r2q1rk1/pB2b1pp/5R2/2p1p3/2P5/2Nb4/PP4PP/R1BQ2K1 b - - 0 15,f8f6 b7d5 g8h8 d1d3,2184,advantage fork interference master mastervsmaster middlegame short,Rxf6 Bd5+ Kh8 Qxd3
0PDdc,6k1/1p2rp2/p2q1npQ/3p1B2/1PnP4/P1N2P2/5PK1/3R4 b - - 3 28,f6h7 d1h1 f7f6 f5g6,2194,crushing interference master middlegame quietmove short,Nh7 Rh1 f6 Bxg6
0FY9t,3r1rk1/Q3bppp/4p3/1p4q1/1PN1P3/P2p1P2/1B4PP/2R2K1R w - - 0 21,c4a5 e7f6 a7f2 d3d2 c1d1 f6b2,2198,advancedpawn advantage interference long middlegame,Na5 Bf6 Qf2 d2 Rd1 Bxb2
002LF,7r/p2q1pk1/1pp3p1/8/6P1/4Q3/PP1R1P1r/5KN1 b - - 0 38,d7g4 e3e5 f7f6 e5c7 g7h6 c7h2,2205,advantage endgame interference long,Qxg4 Qe5+ f6 Qc7+ Kh6 Qxh2+
0dntM,4r2R/5kp1/pq2p1r1/1p1pPp2/8/P6Q/1P3PP1/2R3K1 b - - 5 35,e8h8 h3h8 g6h6 h8c8 f7g6 c1c6 b6d4 c6e6 g6g5 e6h6,2205,crushing endgame interference verylong,Rxh8 Qxh8 Rh6 Qc8 Kg6 Rc6 Qd4 Rxe6+ Kg5 Rxh6
0VevU,3r3k/6pp/5p2/3q1P2/1pr2P2/6P1/P1QpR2P/3R1K2 w - - 2 46,c2d2 d5h1 f1f2 h1h2 f2f3 h2h5,2205,crushing endgame exposedking interference long,Qxd2 Qh1+ Kf2 Qxh2+ Kf3 Qh5+
05cb6,r4rk1/p3pp1p/1p4p1/3P1q2/2P4b/1Q3R2/PP2N3/3K2R1 b - - 2 34,f5b1 d1d2 b1e4 f3f4 e4e5 f4h4,2213,advantage interference long middlegame,Qb1+ Kd2 Qe4 Rf4 Qe5 Rxh4
0DRVH,r4rk1/bp3p1R/p1p1bqB1/2P5/3P2n1/1P1Q1NPp/PB3P1P/R5K1 w - - 3 27,g6h5 e6f5 d3d2 g8h7 f3g5 h7g8,2219,advantage defensivemove fork interference long middlegame,Bh5 Bf5 Qd2 Kxh7 Ng5+ Kg8
0Qwml,3r2k1/3P1ppp/8/b2Q4/8/6P1/4q2P/B2R3K w - - 1 34,a1g7 d8d7 d5d7 e2f3 h1g1 a5b6 g7d4 f3d1,2236,advantage endgame interference sacrifice verylong,Bxg7 Rxd7 Qxd7 Qf3+ Kg1 Bb6+ Bd4 Qxd1+
0dW09,4b3/4P3/3K4/p2B1k2/6p1/6P1/8/8 b - - 0 45,a5a4 d5c6 e8f7 c6a4,2254,bishopendgame crushing endgame interference master short,a4 Bc6 Bf7 Bxa4
0pRPF,r2br3/p2q2kn/1p2b3/3pP1p1/3P1B2/3B1Q2/PPR2KP1/7R b - - 1 31,e6f5 e5e6 e8e6 d3f5,2258,crushing interference middlegame short,Bf5 e6 Rxe6 Bxf5
0ntvD,3r3r/p1k4p/2pb2p1/Qp2qp2/1PB1p3/P3P1PP/3R1P2/3R2K1 b - - 1 27,c7b7 c4d5 c6d5 a5b5,2284,advantage deflection interference middlegame sacrifice short,Kb7 Bd5 cxd5 Qxb5+
052ot,8/1p2k3/2p1p3/p3qpQ1/P7/2P3P1/1PK3P1/8 b - - 13 40,e7d6 g5d8 d6c5 d8a5 b7b5 a5a7 c5d6 a7b8,2299,crushing endgame interference queenendgame verylong,Kd6 Qd8+ Kc5 Qxa5+ b5 Qa7+ Kd6 Qb8+
0UyLJ,6k1/1Q3p1p/p3p1p1/8/P2P3b/3NP3/1P4Pq/5K2 w - - 0 28,d3e5 h2h1 f1e2 h1e1 e2d3 e1d1 d3c4 d1c2 c4b4 c2b2,2305,crushing endgame interference verylong,Ne5 Qh1+ Ke2 Qe1+ Kd3 Qd1+ Kc4 Qc2+ Kb4 Qxb2+
0jDa5,2br1k2/p1p2ppQ/1pB1pb1p/8/3P4/5N2/1qPK1PPP/3R3R w - - 2 19,d1b1 f6g5 f3g5 d8d4 d2e1 b2b1,2322,advantage deflection interference long master middlegame sacrifice,Rb1 Bg5+ Nxg5 Rxd4+ Ke1 Qxb1+
06CAz,r1b1r1k1/ppp1pp1p/5bpP/8/2Pq4/2NB1Q2/PP5P/R1B1K2R w KQ - 1 14,c1f4 e7e5 f4e3 d4d3,2326,advantage interference middlegame short,Bf4 e5 Be3 Qxd3
0bFfm,5rk1/p5p1/4p3/4R2p/3PP1K1/1QP3P1/7P/5q2 w - - 0 43,e5h5 f1e2 g4h4 e2h2 h4g4 h2e2,2334,crushing endgame interference long,Rxh5 Qe2+ Kh4 Qxh2+ Kg4 Qe2+
0AFgI,5rk1/pp6/2pb1q2/3p2p1/3P3p/2P1Q1P1/PP1NNnKP/5R2 b - - 1 26,h4g3 e2g3 d6f4 e3f2,2336,advantage capturingdefender interference middlegame short,hxg3 Nxg3 Bf4 Qxf2
01A5W,4r1k1/pp3p2/3p1Ppq/5P2/4r3/6RP/PP3Q2/6RK b - - 2 39,e4e2 g3g6 f7g6 f6f7 g8f7 f5g6 f7e7 f2e2,2341,advancedpawn attraction crushing doublecheck endgame interference intermezzo sacrifice verylong,Re2 Rxg6+ fxg6 f7+ Kxf7 fxg6+ Ke7 Qxe2+
0jvMb,rnb2rk1/pp2pp1p/3p2p1/8/1q2BP2/3QBN2/PbP2KPP/1R5R b - - 1 13,b4c3 d3b5 b2a3 b1b3 c3c7 b3a3,2345,advantage interference long middlegame,Qc3 Qb5 Ba3 Rb3 Qc7 Rxa3
08VOZ,r5k1/5r1p/1q1p1pp1/3Pn3/3N4/1p3P2/PP1QB3/2KR3R w - - 0 26,d4b3 a8a2 b3d4 e5d3 e2d3 b6d4 d3b5 d4d2 c1d2 a2b2,2362,advantage attraction interference middlegame queensideattack verylong,Nxb3 Rxa2 Nd4 Nd3+ Bxd3 Qxd4 Bb5 Qxd2+ Kxd2 Rxb2+
0eily,6k1/p4pp1/8/1p1QP2p/q7/5P2/Pr1NR2P/3K4 w - - 2 38,d2b3 b2b1 d1d2 a4a2 d2e3 a2b3 d5b3 b1b3,2377,advantage endgame exposedking interference master verylong,Nb3 Rb1+ Kd2 Qxa2+ Ke3 Qxb3+ Qxb3 Rxb3+
0ef2o,2r2rk1/p4pp1/R3p2p/2NnN1qP/1p1P4/8/1Q3PP1/1K5R w - - 2 28,g2g3 c8c5 d4c5 d5c3 b1a1 g5e5,2379,advantage exposedking interference long master middlegame sacrifice,g3 Rxc5 dxc5 Nc3+ Ka1 Qxe5
0FKHR,r5k1/ppp3bp/1q2rnp1/4B3/2Q3PP/4P3/PPP2P2/2KR3R b - - 0 20,f6g4 d1d6 c7d6 c4e6 g8h8 e5g7,2396,advantage fork interference long middlegame pin,Nxg4 Rd6 cxd6 Qxe6+ Kh8 Bxg7+
0bM6l,r1b2k2/ppB1n1pp/2n5/3pp3/1q6/1B2PP2/P1P1KP1P/R2Q3R w - - 2 16,b3d5 c6d4 e3d4 e7d5,2410,advantage interference intermezzo middlegame short,Bxd5 Nd4+ exd4 Nxd5
0aZ38,4r1k1/pp3ppp/2n2n2/7q/1PPp2b1/P2B1N2/3B1PPP/R2Q2K1 w - - 0 17,h2h3 g4f3 d1f3 h5f3 g2f3 c6e5 d3e2 d4d3 e2d1 e5c4,2415,advantage interference master middlegame verylong,h3 Bxf3 Qxf3 Qxf3 gxf3 Ne5 Be2 d3 Bd1 Nxc4
0DLI1,r1q3k1/p2R1pb1/1p2n1pp/1Np5/8/1Q3PB1/PP2n2P/3R2K1 w - - 11 33,g1h1 e2d4 b5d4 c8d7 d4e6 d7e6 b3e6 f7e6,2420,advantage interference middlegame verylong,Kh1 N2d4 Nxd4 Qxd7 Nxe6 Qxe6 Qxe6 fxe6
09jLi,N1b4r/pp1k1ppp/4p3/2b1n3/2Pp2Pq/3B4/PP3P1P/R1BQK2R w KQ - 0 14,c1f4 c5b4 f4d2 e5d3 e1e2 d3b2,2421,crushing interference long middlegame,Bf4 Bb4+ Bd2 Nxd3+ Ke2 Nxb2
0E0zm,5r2/4p1k1/p1np2p1/q6N/3PP3/1RN2r2/2PQ4/4K2R b K - 0 26,g6h5 d2g2 g7f7 g2f3,2476,advantage interference master middlegame short,gxh5 Qg2+ Kf7 Qxf3+
0lrLn,3q1rk1/Q2b1ppp/8/8/8/2bBB3/PrP2PPP/R3K2R w KQ - 2 16,e1e2 d7b5 d3b5 b2c2 e2f1 c3a1,2482,crushing deflection discoveredattack interference long middlegame sacrifice,Ke2 Bb5 Bxb5 Rxc2+ Kf1 Bxa1
0KpU4,r3r1k1/1ppb1p1p/3p1q2/p1nP1Pp1/2PN4/1P6/P1B3PP/2RQ1RK1 w - - 0 22,d1g4 e8e4 c2e4 f6d4 g1h1 c5e4,2490,advantage interference kingsideattack long master middlegame sacrifice,Qg4 Re4 Bxe4 Qxd4+ Kh1 Nxe4
04IsZ,5k2/2rR1pp1/5b1p/1P5P/P1B5/1K2r3/8/3R4 w - - 0 36,b3b4 f6c3 b4b3 c3d4 b3a2 c7d7,2521,advantage discoveredattack endgame interference long,Kb4 Bc3+ Kb3 Bd4+ Ka2 Rxd7
094dl,5k1r/p6p/3R2p1/3QR3/7q/5P2/PP3KPP/2r5 w - - 3 24,f2e3 c1e1 e3d2 h4b4 d2c2 b4a4 b2b3 a4a2 c2c3 a2a1,2521,crushing endgame interference verylong,Ke3 Re1+ Kd2 Qb4+ Kc2 Qa4+ b3 Qxa2+ Kc3 Qa1+
0Im0t,4r1k1/pq6/5ppB/3nn2p/1p3P1P/2r2BQ1/PKP3P1/3R3R b - - 2 26,b7c6 f4e5 c3c2 b2b1 d5c3 b1c2,2522,crushing interference long master middlegame,Qc6 fxe5 Rxc2+ Kb1 Nc3+ Kxc2
0lGAO,5r2/2pk3p/2pp2p1/p5qn/N3PP2/1PQR2P1/2P4P/6K1 b - - 0 24,f8f4 a4c5 d7e7 c3a5 g5c5 a5c5 d6c5 g3f4,2572,advantage endgame interference pin verylong,Rxf4 Nc5+ Ke7 Qxa5 Qxc5+ Qxc5 dxc5 gxf4
08hpi,4qr2/6p1/5bk1/2pQp1p1/2P1P1R1/5B1R/P5K1/1r6 b - - 11 38,e8a8 g4g5 f6g5 f3h5 g6h7 h5e8 g5h6 d5a8,2581,advantage clearance discoveredattack interference middlegame sacrifice verylong,Qa8 Rxg5+ Bxg5 Bh5+ Kh7 Be8+ Bh6 Qxa8
06NWB,7k/ppp3p1/4B2p/2b2R2/8/2Q3P1/PPP2PK1/2qr4 w - - 7 30,f5f7 d1g1 g2h3 c1f1 h3g4 f1e2 g4f5 e2f2,2645,advantage endgame fork interference verylong,Rf7 Rg1+ Kh3 Qf1+ Kg4 Qe2+ Kf5 Qxf2+
04YUe,1r1b1r1k/Rp6/3P1p2/2P4q/1P6/5Kp1/1B4Q1/4R3 w - - 2 38,f3f4 h5g5 f4f3 g5f5 f3e2 f8e8 e2d2 e8e1 d2e1 f5b1 e1e2 b1b2,2694,attraction crushing interference middlegame verylong,Kf4 Qg5+ Kf3 Qf5+ Ke2 Re8+ Kd2 Rxe1 Kxe1 Qb1+ Ke2 Qxb2+
0Xpwd,4r1k1/1B3p1p/pb2r1p1/8/4Q3/8/PqP2PPP/R4RK1 w - - 0 22,e4d3 b6f2 g1h1 f2e1 b7c6 b2a1 c6e8 e6e8,2699,crushing interference master middlegame quietmove verylong,Qd3 Bxf2+ Kh1 Be1 Bc6 Qxa1 Bxe8 Rxe8
04F9F,2r5/4p2k/p3P1pp/2pPQp2/1p6/8/qP4PP/2KR3R w - - 0 28,h2h4 c5c4 c1d2 c4c3 d2e2 c3b2 d1d2 b2b1q h1b1 a2b1,2717,advancedpawn crushing endgame interference pin promotion queensideattack quietmove verylong,h4 c4 Kd2 c3+ Ke2 cxb2 Rd2 b1=Q Rxb1 Qxb1
0caK4,1k1r4/6r1/1p2p3/pN1q1p2/P2PnP2/4P1P1/3Q3P/2R2RK1 w - - 2 28,d2e1 e4g3 h2g3 d8g8 f1f2 g7g3 g1f1 g3g1 f1e2 g1e1,2718,advantage interference intermezzo kingsideattack middlegame quietmove sacrifice skewer verylong,Qe1 Nxg3 hxg3 Rdg8 Rf2 Rxg3+ Kf1 Rg1+ Ke2 Rxe1+
05CjS,8/p4pp1/7p/2k1P2P/r1p2P2/2K1P3/P1R2P2/8 w - - 0 37,c2d2 a4a3 c3c2 a3a2 c2d1 a2d2 d1d2 c5d5,2741,crushing endgame exposedking interference rookendgame verylong,Rd2 Ra3+ Kc2 Rxa2+ Kd1 Rxd2+ Kxd2 Kd5
03iyb,7r/5p2/3R1np1/2Pk4/6q1/Q7/6Pr/6K1 b - - 7 36,d5e5 a3b2 e5f4 b2f2 f4g5 f2f6 g5h6 f6h8,2797,crushing endgame interference verylong,Ke5 Qb2+ Kf4 Qf2+ Kg5 Qxf6+ Kh6 Qxh8+
