PuzzleId,FEN,Moves,Rating,Themes,SAN
0mezG,8/6rp/3p4/3k4/1P5P/1R1K4/6P1/8 w - - 1 39,b3b2 g7g3 d3d2 g3g2,729,crushing endgame interference rookendgame short,Rb2 Rg3+ Kd2 Rxg2+
03H2V,6r1/p7/1ppkp1r1/5p2/3P1P2/P1PN1K1P/1P1R2P1/8 w - - 7 39,d3e5 g6g3 f3e2 g3g2,809,advantage deflection endgame interference short,Ne5 Rg3+ Ke2 Rxg2+
0lZwO,8/pr5p/3k4/R2p2p1/3Pp1P1/1P5P/P2K4/8 b - - 1 39,b7f7 a5a6 d6d7 a6a7,826,crushing endgame interference master rookendgame short,Rf7 Ra6+ Kd7 Rxa7+
0ajTl,4b1k1/ppp2pB1/3p1pB1/4q3/2P4Q/6P1/P4P1P/6K1 b - - 0 24,f7g6 h4h8 g8f7 h8f8 f7e6 f8e8,911,crushing deflection endgame exposedking interference long,fxg6 Qh8+ Kf7 Qf8+ Ke6 Qxe8+
0MQAS,r6r/p2qk2p/2pbpp2/3p3Q/3P4/P7/1P3PPP/RN3RK1 b - - 3 15,h8g8 h5h7 e7d8 h7g8,918,crushing interference middlegame short,Rhg8 Qxh7+ Kd8 Qxg8+
08SOm,6rk/5p2/4p1r1/p2pR3/1pP3P1/nP5K/P5B1/2R5 b - - 0 36,g6g4 e5h5 h8g7 h3g4,926,crushing endgame interference short,Rxg4 Rh5+ Kg7 Kxg4
0cbT2,8/5p2/6kp/5R2/2P2K2/5P1P/2r5/8 w - - 1 49,c4c5 c2c4 f4e5 c4c5,938,crushing endgame interference rookendgame short,c5 Rc4+ Ke5 Rxc5+
04I3d,1r3rk1/5ppp/1Q2b3/p7/2P1Pp2/P3bP2/R5PP/1N2KB1R w K - 1 18,b6a5 b8b1 e1e2 e6c4,942,hangingpiece interference mate matein2 middlegame short,Qxa5 Rxb1+ Ke2 Bxc4#
0UsAp,r4k1r/p2Bpp1p/6p1/q1N1b3/1p6/1P2n3/P1Q2PPP/2R1K2R w K - 2 20,f2e3 e5c3 e1f2 a5c5,953,advantage interference master mastervsmaster middlegame short,fxe3 Bc3+ Kf2 Qxc5
0h6gO,rr4k1/3q2pp/3Pp3/p1P1R3/1p2P3/1K5P/1PQ3P1/3R4 w - - 1 30,c5c6 a5a4 b3c4 d7c6,963,crushing endgame interference short,c6 a4+ Kc4 Qxc6+
0cU1q,2r1n3/4P2p/6pk/3R4/8/P7/KP5P/8 b - - 0 36,h6g7 d5d8 c8c7 d8e8,965,crushing endgame interference short,Kg7 Rd8 Rc7 Rxe8
0KAJX,r2qkb1r/1ppbn3/p1npp3/4PppB/3P3B/8/PPP2PPP/RN1Q1RK1 b kq - 1 11,e7g6 h5g6 e8e7 h4g5,1025,hangingpiece interference mate matein2 middlegame short,Ng6 Bxg6+ Ke7 Bxg5#
0UrRF,2r2rk1/p4ppp/5n2/4q3/8/3BPQ2/PP2KPPP/R6R w - - 0 17,g2g4 e5b2 e2f1 b2a1,1045,crushing interference middlegame short,g4 Qxb2+ Kf1 Qxa1+
0NqoB,r1bqk2r/pp3ppp/8/2b1P3/3N4/3P4/PB4PP/R2QKB1R b KQkq - 0 12,c5d4 d1a4 c8d7 a4d4,1050,advantage interference middlegame short,Bxd4 Qa4+ Bd7 Qxd4
0Gt4n,r5r1/b1p1kp2/2Qp1p2/1B1P2q1/1P2Pp2/6p1/2P2PP1/R4RK1 b - - 1 26,a7b6 c6d7 e7f8 a1a8 f8g7 a8g8,1074,advantage interference long middlegame,Bb6 Qd7+ Kf8 Rxa8+ Kg7 Rxg8+
0TgmV,8/1kp1n2R/1p2PR2/6K1/5P2/8/P6r/8 b - - 1 55,h2h7 f6f7 h7h2 f7e7,1074,crushing endgame interference short,Rxh7 Rf7 Rh2 Rxe7
0K3B5,r6r/pp2pk1p/3p1P2/2pP2p1/3q4/3B2P1/5R2/1Q4K1 b - - 0 27,e7f6 b1b7 f7f8 b7a8,1080,crushing endgame interference master mastervsmaster short,exf6 Qxb7+ Kf8 Qxa8+
01Qta,6r1/8/p1p1k3/P1B3pr/1P2ppRP/2P5/7K/6R1 w - - 2 44,g4g5 h5h4 h2g2 g8g5,1089,crushing endgame interference intermezzo short,Rxg5 Rxh4+ Kg2 Rxg5+
0j2CC,r2qkb1r/1p1b1ppp/p1pp4/3N4/3QP3/4B3/PPP2PPP/R3K2R w KQkq - 0 11,d5b6 c6c5 d4c3 d8b6,1091,advantage interference middlegame short,Nb6 c5 Qc3 Qxb6
0BL0C,2r4r/pp3kp1/4p2p/q2pPn2/3N4/2PQ4/PP3P1P/R3K1R1 b Q - 0 20,f5d4 d3g6 f7e7 g6g7 e7d8 g7h8,1128,crushing deflection interference long middlegame,Nxd4 Qg6+ Ke7 Qxg7+ Kd8 Qxh8+
0OTvx,r6r/1ppknQp1/p1np3p/4p2B/PP6/N1Pb3P/6P1/R1B1q1bK b - - 7 20,h8f8 h5g4 d3f5 g4f5 d7d8 f7f8,1131,interference long mate matein3 middlegame,Rhf8 Bg4+ Bf5 Bxf5+ Kd8 Qxf8#
0P51N,2kr3r/pp3p2/2p2qp1/3pn2p/3nPP1P/6B1/PPP5/2KQ1RNR b - - 2 21,e5g4 e4e5 f6f5 d1d4,1135,advantage interference middlegame short,Ng4 e5 Qf5 Qxd4
0Vi3v,8/8/7p/2rpk3/8/3KP2R/6P1/8 b - - 3 47,c5c6 h3h5 e5e6 h5h6 e6d7 h6c6,1136,crushing endgame interference long rookendgame,Rc6 Rh5+ Ke6 Rxh6+ Kd7 Rxc6
0bMdS,3r2k1/7R/4ppp1/pp6/2p4R/3r1PKP/PP4P1/8 b - - 0 38,g8f8 h7h8 f8e7 h4h7 e7d6 h8d8,1140,crushing deflection endgame exposedking interference long rookendgame,Kf8 Rh8+ Ke7 R4h7+ Kd6 Rxd8+
0NSOo,r6r/pp1k4/3q1p2/2pp1bp1/6p1/2NP1B2/PPP2PP1/R2QR1K1 w - - 0 20,f3g4 d6h2 g1f1 h2h1 f1e2 f5g4,1140,crushing interference kingsideattack long middlegame,Bxg4 Qh2+ Kf1 Qh1+ Ke2 Bxg4+
0Cw2Y,4rrk1/q5p1/4p1Q1/pbppp1NP/N2p4/1P6/P1P2P2/1R4K1 b - - 1 25,f8f6 g6h7 g8f8 h7h8 f8e7 h8g7,1141,crushing deflection interference kingsideattack long middlegame,Rf6 Qh7+ Kf8 Qh8+ Ke7 Qxg7+
067XK,2b5/p1p2kqp/1p1p2p1/3P4/1PP5/4QPn1/P2K2P1/R2R4 w - - 11 37,d1e1 g7b2 d2d1 b2a1,1150,advantage endgame interference short,Re1 Qb2+ Kd1 Qxa1+
0WkIU,r2qkb1r/3bnpp1/p1n1p2p/1B1pP2P/3P2P1/N1P2N2/3B1P2/R2QK2R b KQkq - 0 14,a6b5 a3b5 e7c8 a1a8,1158,crushing discoveredattack interference master middlegame short,axb5 Nxb5 Nc8 Rxa8
0Iv0a,rn1qkb1r/5pp1/p1ppb2p/3N4/2pQP3/7P/PPPN1PP1/R1B1K2R w KQkq - 0 12,d5b6 c6c5 d4c3 d8b6,1172,advantage interference opening short,Nb6 c5 Qc3 Qxb6
0gPAc,rnb2rk1/ppp2ppp/8/2q5/3N4/P1n3P1/3PP1BP/R1BQK2R w KQ - 0 12,d2c3 c5c3 c1d2 c3d4,1180,advantage fork interference opening short,dxc3 Qxc3+ Bd2 Qxd4
02F4S,8/4n1k1/4P3/3p2PP/rp1P4/3K4/P3R3/8 w - - 0 47,e2f2 a4a3 d3c2 a3a2 c2b3 a2f2,1181,crushing endgame interference long skewer,Rf2 Ra3+ Kc2 Rxa2+ Kb3 Rxf2
0XxBr,r3r1k1/2q2pp1/2p1b2p/P2pP3/3B4/b4N1P/5PP1/1R1QR1K1 b - - 0 23,a8a5 d4b6 c7c8 b6a5,1181,advantage fork interference middlegame short,Rxa5 Bb6 Qc8 Bxa5
0YHvG,r1bqr1k1/6pp/p1p1pb2/2p5/8/3P1N2/PPPB2PP/R3QRK1 w - - 0 16,f3e5 d8d4 d2e3 d4e5,1195,crushing interference middlegame short,Ne5 Qd4+ Be3 Qxe5
0a62z,r1b2kr1/pppnq3/8/4PppB/P1N1p2p/2P1P3/1P3PPP/R2Q1RK1 b - - 0 18,d7e5 c4e5 e7e5 d1d8 f8g7 d8g5,1196,advantage exposedking interference long middlegame,Nxe5 Nxe5 Qxe5 Qd8+ Kg7 Qxg5+
0XicM,8/R1p5/8/8/1kP4r/3K4/8/8 b - - 10 58,h4c4 a7b7 b4c5 b7c7 c5d5 c7c4,1198,crushing endgame interference long rookendgame,Rxc4 Rb7+ Kc5 Rxc7+ Kd5 Rxc4
0izZo,2kr3r/p1p4p/2Q2n2/4pp2/8/qP1PP1PP/2P2P2/1K1R3R b - - 0 23,f6d5 c6a8 c8d7 a8d5,1205,advantage interference middlegame queensideattack short,Nd5 Qa8+ Kd7 Qxd5+
0p1p0,r4rk1/1bq1bppp/p1n1p3/1p2P3/2p2P2/P1P1BN2/1P3QPP/R2N1RK1 b - - 3 17,c6a5 e3b6 c7c6 b6a5,1211,advantage interference master middlegame short,Na5 Bb6 Qc6 Bxa5
0UQCT,r6r/pppk1pQp/2bn4/5P2/7q/1N6/PPP3PP/R1BK2R1 b - - 2 14,h4h2 b3c5 d7c8 g7h8,1211,crushing interference middlegame short,Qxh2 Nc5+ Kc8 Qxh8+
0bPIw,r3r1k1/1q3p2/p7/1p2p3/8/4B1Q1/PP2p3/1K1R3b b - - 3 31,g8f8 e3h6 f8e7 g3e5,1212,interference mate matein2 middlegame short,Kf8 Bh6+ Ke7 Qxe5#
0LtqW,rn1qkbnr/p4ppp/2b5/3PP3/8/2p2Q2/5PPP/R1B1KBNR b KQkq - 0 12,c6d5 f1b5 b8d7 f3d5,1215,crushing interference intermezzo opening short,Bxd5 Bb5+ Nd7 Qxd5
0B5Yp,4r2k/p7/3p1p1b/1p1N1n2/3P1PRP/4BK2/PPr5/6R1 w - - 0 27,g4g6 f5h4 f3g4 h4g6,1227,advantage fork interference master middlegame short,Rg6 Nxh4+ Kg4 Nxg6
0BuLe,Qnk2R2/1p4r1/3pq3/1Pp5/7b/8/2P2RP1/6K1 b - - 1 31,h4d8 f8d8 c8d8 a8b8 d8d7 b8b7,1228,attraction crushing deflection interference long middlegame,Bd8 Rxd8+ Kxd8 Qxb8+ Kd7 Qxb7+
03F5s,r3r1k1/ppp1Bpp1/6p1/1P6/3P2n1/1QP5/P2N1PPq/R3RK2 w - - 2 23,d2f3 h2h1 f3g1 g4h2 f1e2 e8e7,1230,advantage interference long middlegame,Nf3 Qh1+ Ng1 Nh2+ Ke2 Rxe7+
0EFIo,4rrk1/pp2Rppp/2p5/2Pp4/1P1P1Qn1/P1N3Pq/1B3P1P/4R1K1 w - - 3 22,e7e8 h3h2 g1f1 h2h1 f1e2 f8e8,1231,advantage interference kingsideattack long middlegame,Rxe8 Qxh2+ Kf1 Qh1+ Ke2 Rxe8+
0WzKz,8/8/1p1kp3/3p1p2/8/2QK2P1/PP4r1/8 w - - 4 46,d3d4 e6e5 d4d3 g2g3 d3d2 g3c3,1232,crushing endgame interference long queenrookendgame skewer,Kd4 e5+ Kd3 Rxg3+ Kd2 Rxc3
0BDFq,3rkR2/8/p3p2p/1p6/3q4/2N5/P5rP/5R1K b - - 1 28,e8e7 f1f7 e7d6 f8d8 d6e5 d8d4,1237,crushing deflection endgame interference long skewer,Ke7 R1f7+ Kd6 Rxd8+ Ke5 Rxd4
01GCT,5r1k/6p1/R3bn1p/8/1P6/P2PqB2/1B2P2P/6RK b - - 0 30,h8h7 f3e4 h7h8 a6e6,1273,advantage interference middlegame short,Kh7 Be4+ Kh8 Rxe6
0T7CP,r4r1k/1p1PR1bp/p5p1/8/PPB2pP1/7q/2PQ1P2/4R1K1 w - - 0 26,d2e2 f4f3 e2f1 h3g4,1282,crushing interference kingsideattack middlegame short,Qe2 f3 Qf1 Qxg4+
0Sn2e,1k6/p2R1p1p/1p6/1P6/4KP2/P7/1P4q1/3R4 w - - 5 56,e4f5 g2g6 f5e5 g6e6 e5d4 e6d7,1296,crushing endgame interference long queenrookendgame,Kf5 Qg6+ Ke5 Qe6+ Kd4 Qxd7+
0XVJf,r4k1r/ppp2ppp/2pb4/8/5qb1/3B2P1/PPPP1P1P/R1B1RQK1 b - - 0 13,f4d4 e1e4 d4f6 e4g4,1298,advantage interference middlegame short,Qd4 Re4 Qf6 Rxg4
0oQEN,5rk1/ppp3p1/3b3p/3P4/1P3q2/P6P/2Q1RPP1/4R1K1 w - - 4 27,e2e8 f4h2 g1f1 h2h1 f1e2 f8e8,1312,crushing endgame interference long,Re8 Qh2+ Kf1 Qh1+ Ke2 Rxe8+
0H9PW,5rk1/pbq3p1/1p2pP1p/4N3/2Pr4/1P6/2Q2P1P/1B2R1K1 b - - 0 26,f8f6 c2h7 g8f8 h7h8 f8e7 h8g7,1323,advantage deflection interference long middlegame,Rxf6 Qh7+ Kf8 Qh8+ Ke7 Qxg7+
0WW4t,4r2k/ppp3pp/6p1/2n1r3/3p1qPP/3P1P2/PPB3QN/3K1R1R w - - 2 26,f1e1 e5e1 h1e1 e8e1 d1e1 f4c1 e1f2 c1c2,1328,attraction crushing exposedking interference middlegame verylong,Re1 Rxe1+ Rxe1 Rxe1+ Kxe1 Qc1+ Kf2 Qxc2+
0EywV,r4rk1/pbpp1ppp/1p3n2/3Pn3/1q2PR2/4B1P1/PPP1N1BP/R2Q2K1 b - - 4 13,b4b2 e3d4 b2a3 d4e5,1328,crushing interference middlegame short,Qxb2 Bd4 Qa3 Bxe5
0dVPg,8/pp6/6r1/1PK1k3/2R3P1/8/8/8 w - - 9 60,c4a4 b7b6 c5c4 g6g4 c4b3 g4a4,1330,crushing endgame interference long rookendgame,Ra4 b6+ Kc4 Rxg4+ Kb3 Rxa4
0ZLJ4,4r3/p1p1r3/7p/1bN1Pk2/5p2/1P3K2/P1P2PP1/3RR3 w - - 1 33,a2a4 b5c6 f3e2 e7e5,1330,advantage endgame interference short,a4 Bc6+ Ke2 Rxe5+
0ULHn,1r4k1/p1p2ppp/2P1p3/3pP3/1B3P1b/P3q2P/2Q3P1/5R1K b - - 1 24,h4g3 f1f3 e3d4 f3g3,1333,advantage endgame interference short,Bg3 Rf3 Qd4 Rxg3
0FuFJ,4k3/1pN2rpp/p1n5/8/2Q5/4q3/PP4PP/3R3K b - - 0 24,f7c7 c4g8 e8e7 g8g7,1361,crushing endgame interference short,Rxc7 Qg8+ Ke7 Qxg7+
06Vdp,1r1q1k1r/3bbBp1/p1pp1nnp/P3p3/4P3/1Q3N2/1PP1NPPP/R1B2RK1 w - - 1 15,b3c4 d6d5 f7g6 d5c4,1361,advantage interference middlegame short,Qc4 d5 Bxg6 dxc4
0BCpo,3r2kr/p2P1pp1/b1B2n1p/2B1p3/8/2Q4P/qPP2Pn1/2KR2NR w - - 0 22,c6g2 a2a1 c1d2 d8d7,1363,advantage interference middlegame short,Bxg2 Qa1+ Kd2 Rxd7+
0WAZV,1r4k1/6pp/4p3/3pP2P/2PPp3/4P1K1/p7/BrRR4 w - - 3 41,c4c5 b1c1 d1c1 b8b1 c1c2 b1a1,1369,clearance crushing endgame interference long,c5 Rxc1 Rxc1 Rb1 Rc2 Rxa1
0ErhC,8/8/1p1p3R/8/P1k5/2P1K3/1r6/8 b - - 2 44,d6d5 h6c6 c4b3 c6b6,1370,crushing endgame interference rookendgame short,d5 Rc6+ Kb3 Rxb6+
07fcs,6k1/p1q2pb1/4p1p1/4P2p/2bPB2P/2P2Q2/Pr1B1PP1/3R2K1 w - - 0 23,d2g5 c4e2 f3f4 e2d1,1374,crushing fork interference master mastervsmaster middlegame short,Bg5 Be2 Qf4 Bxd1
0Tv5Z,2kr3r/p1pp1Rp1/1p5p/3NP3/2Pn2Q1/3q2P1/PP4P1/2R3K1 w - - 0 23,c1d1 d4e2 g1f2 d3d1,1380,advantage interference middlegame short,Rd1 Ne2+ Kf2 Qxd1
0H2ww,r1b1r1k1/1pp2ppp/p2p1b2/3P4/q3PP2/3B2Q1/PP4PP/R1B2RK1 w - - 3 15,b2b3 a4d4 c1e3 d4d3,1386,crushing fork interference middlegame short,b3 Qd4+ Be3 Qxd3
0MJ8Y,6k1/p1pb2p1/1p1np3/3p2Pp/3Pq2P/PN1Q4/1PP5/1K3R2 w - - 2 29,d3a6 d7b5 a6a7 b5f1,1394,crushing endgame fork interference short,Qa6 Bb5 Qxa7 Bxf1
04Qwc,3r3k/1bq3n1/pp4B1/8/2p5/1P2Q2P/P2N2P1/7K b - - 1 35,d8d6 e3h6 h8g8 h6h7 g8f8 h7h8 f8e7 h8g7,1400,crushing deflection exposedking interference middlegame verylong,Rd6 Qh6+ Kg8 Qh7+ Kf8 Qh8+ Ke7 Qxg7+
0QnjX,q5k1/pp2b2p/4n1pQ/1P1pBp2/3P4/P7/5PPP/2r1R1K1 w - - 0 33,e1c1 e7g5 h6h3 g5c1,1405,advantage endgame fork interference short,Rxc1 Bg5 Qh3 Bxc1
07YoN,6rk/1p6/p7/3N4/3Pp3/2P1P2p/Pn2KRrR/8 b - - 3 39,b2d3 h2h3 h8g7 f2g2,1405,crushing endgame interference short,Nd3 Rxh3+ Kg7 Rxg2+
0fAbc,2r5/2pQ4/8/4p1k1/5p2/2P3q1/P4RBr/6K1 b - - 1 37,c8h8 d7g7 g5h5 g7h8,1421,crushing endgame interference master short,Rch8 Qg7+ Kh5 Qxh8+
0MMDn,1n1r4/1R6/2p1kp2/1n2p3/5PNN/6P1/3r4/4RK2 b - - 0 37,d2d1 f4f5 e6d6 e1d1,1424,crushing interference master middlegame short,Rd1 f5+ Kd6 Rxd1+
0QqD3,2rr2k1/5pp1/1p2p2p/7n/2PP3q/5P2/3QBP1P/3R2RK b - - 3 23,h5f4 g1g4 h4f2 g4f4,1426,crushing interference master middlegame short,Nf4 Rg4 Qxf2 Rxf4
0Ue00,1r3rk1/1b4pp/p1pNp3/2p2p2/2Pq4/3P2Q1/PP3PPP/R4RK1 w - - 1 19,f1e1 f5f4 g3g4 d4d6 g4e6 d6e6,1430,crushing interference long middlegame,Rfe1 f4 Qg4 Qxd6 Qxe6+ Qxe6
0UsUU,r2qk1nr/ppp1bpp1/3pb2p/8/3QPB2/3B4/PPP2PPP/RN2K2R w KQkq - 4 9,d4g7 e7f6 g7g3 f6b2,1430,advantage interference opening short,Qxg7 Bf6 Qg3 Bxb2
0KjQI,2r2k2/1R3ppp/4pn2/4P3/Q7/2qr4/5PPP/5RK1 b - - 0 22,f6d5 a4d7 d5c7 d7c8,1443,advantage interference middlegame short,Nd5 Qd7 Nc7 Qxc8+
0mxgU,8/8/R7/3pk3/6r1/3K4/6P1/8 w - - 1 55,a6a2 g4g3 d3c2 g3g2 c2b3 g2a2,1451,crushing endgame exposedking interference long rookendgame,Ra2 Rg3+ Kc2 Rxg2+ Kb3 Rxa2
0m02x,5rk1/p4pp1/5b1p/1Q2pb2/1P6/q3B2P/P4PP1/2R1R1K1 w - - 2 24,e1e2 f5d3 b5b7 d3e2,1457,advantage fork interference middlegame short,Re2 Bd3 Qb7 Bxe2
01u7X,3r2k1/4qp2/4r1pp/1p6/pP5P/4bRP1/P1B1Q1PK/5R2 w - - 1 30,h2h1 d8d2 e2b5 d2c2,1457,advantage interference middlegame short,Kh1 Rd2 Qxb5 Rxc2
0QNHa,3rq1r1/4pb1k/pp5p/3p1P2/P2B2Pb/2P4P/1PQ1R3/5R1K b - - 0 30,e8c6 f5f6 g8g6 f6e7,1462,advancedpawn crushing discoveredattack interference middlegame short,Qc6 f6+ Rg6 fxe7
0PXsL,r3rk2/5p1Q/p1p1q1p1/1p1n4/6P1/P6P/1PP2P2/4RRK1 b - - 1 28,e6e1 h7h8 f8e7 f1e1 e7d7 e1e8,1470,advantage endgame interference intermezzo long,Qxe1 Qh8+ Ke7 Rxe1+ Kd7 Rxe8
0IPPE,r3kb1r/p4pp1/np2pq1p/1bppN3/2PP4/P5P1/1P2PPBP/R2QK2R b KQkq - 0 12,b5c4 d1a4 b6b5 a4a6,1471,crushing interference middlegame short,Bxc4 Qa4+ b5 Qxa6
0ZzhM,r3kb1r/pp3pp1/n3pnbp/qNpp4/3P1BPP/2P1PP2/PP6/R2QKBNR w KQkq - 1 10,f1d3 g6d3 d1d3 c5c4 d3c2 a5b5,1477,advantage interference long middlegame,Bd3 Bxd3 Qxd3 c4 Qc2 Qxb5
0MTrJ,r3kb1r/pp4pp/2p2p2/q2Np3/2B2R2/3Q4/PPP3PP/3R2K1 b kq - 0 18,c6d5 c4b5 e8e7 d3d5,1479,advantage interference intermezzo middlegame short,cxd5 Bb5+ Ke7 Qxd5
0BjIb,3r4/p4k1R/8/1pp1Pn2/5PR1/2P5/PP1r4/2K5 b - - 2 33,f7e6 g4g6 e6d5 c1d2,1483,advantage endgame interference master short,Ke6 Rg6+ Kd5 Kxd2
029M7,1k1r4/ppp2pb1/4b2p/5qp1/1P3p2/3r1N2/1P3QPP/R1B1R1K1 b - - 2 22,d3d1 f2a7 b8c8 a7a8 c8d7 e1d1,1488,crushing interference long middlegame queensideattack,Rd1 Qxa7+ Kc8 Qa8+ Kd7 Rxd1+
0Eg0i,r3k1r1/1p1q1p2/2n2p1b/1pPpp2p/1P5N/P4Q2/1BP2PPP/R4RK1 w q - 5 16,f3f6 h6g5 f6f3 g5h4,1514,advantage interference middlegame short,Qxf6 Bg5 Qf3 Bxh4
0cogD,1r4k1/1rq2pp1/3p3p/p4Q2/3PP3/4R2P/5PP1/R5K1 w - - 3 32,a1a5 b7b1 g1h2 d6d5 f5e5 c7a5,1518,advantage discoveredattack endgame interference long,Rxa5 Rb1+ Kh2 d5+ Qe5 Qxa5
0UuR1,8/2p2pk1/1p4q1/p2P3p/Pb2r2P/1P2NQP1/7K/5R2 b - - 3 39,b4d6 e3f5 g7f8 f3e4,1521,crushing endgame interference master short,Bd6 Nf5+ Kf8 Qxe4
0fRpS,3r2kr/pp3p1p/1q4p1/2b1Q3/8/P2P4/1P3PPP/RN3RK1 w - - 3 23,b2b4 c5d4 e5e1 d4a1,1530,crushing fork interference middlegame short,b4 Bd4 Qe1 Bxa1
0LrNv,7k/6pp/2Q2n2/pP6/P1N5/5pPP/4qP1K/8 w - - 1 38,c6c8 f6g8 c8c5 e2f1 c4e3 f1f2,1539,crushing defensivemove endgame interference long,Qc8+ Ng8 Qc5 Qf1 Ne3 Qxf2+
0Zg4N,1k1B3r/1p6/p2N2p1/8/QP1n4/2q4P/P5P1/5RK1 w - - 0 30,d8f6 d4e2 g1f2 c3f6,1550,advantage discoveredattack interference middlegame short,Bf6 Ne2+ Kf2 Qxf6+
7400,r5k1/pb1qb1p1/4p1QB/5r2/Pn1pN3/3B4/5PPP/R4RK1 b - - 0 22,e7f6 e4f6 f5f6 g6h7 g8f8 h7h8 f8e7 h8g7,1551,crushing deflection interference kingsideattack middlegame pin verylong,Bf6 Nxf6+ Rxf6 Qh7+ Kf8 Qh8+ Ke7 Qxg7+
0PrN9,8/7p/2r1k3/p1p4R/P1P1K3/1P6/8/8 b - - 3 46,c6c7 h5h6 e6e7 h6h7,1552,crushing endgame interference master mastervsmaster rookendgame short,Rc7 Rh6+ Ke7 Rxh7+
05u06,4r1k1/4rpp1/2pq3p/ppNp4/3P4/P1P1R2b/1PQ2P2/1B2R1K1 b - - 1 31,e7e3 c2h7 g8f8 h7h8 f8e7 e1e3,1553,crushing interference kingsideattack long middlegame,Rxe3 Qh7+ Kf8 Qh8+ Ke7 Rxe3+
0kzam,r2q1r2/2ppbkpQ/pp2p3/4P3/8/2P5/PPB2PPP/R1B3K1 b - - 0 18,f8h8 c2g6 f7f8 h7h8,1561,interference mate matein2 middlegame short,Rh8 Bg6+ Kf8 Qxh8#
0Mh5F,8/8/2k5/6rp/P2K4/1R4P1/8/8 w - - 3 54,d4c4 g5g4 c4c3 g4g3 c3c2 g3b3,1571,crushing endgame interference long rookendgame,Kc4 Rg4+ Kc3 Rxg3+ Kc2 Rxb3
0dwrX,r4k1r/2p2ppp/p1Nqpn2/3p4/Q2P4/P1PbP1P1/1P3PP1/RN2K1R1 w Q - 3 15,b1d2 d3b5 a4c2 b5c6,1574,crushing interference middlegame short,Nd2 Bb5 Qc2 Bxc6
0RxLE,5nk1/1Q3p1p/1B6/4q1p1/2B5/p5P1/5PKP/r7 b - - 1 36,e5g7 b6d4 g7g6 d4a1,1575,advantage endgame interference short,Qg7 Bd4 Qg6 Bxa1
0oAOB,3q1rk1/1b3pbp/p5p1/1p1p4/nQ1P4/P3PBBP/5PP1/2R3K1 b - - 0 20,d8d7 c1c7 d7e6 c7b7,1587,advantage interference middlegame short,Qd7 Rc7 Qe6 Rxb7
0TeCP,r5k1/p4p1p/6p1/3P4/4q3/1R6/PP2K3/R2Q4 w - - 0 27,b3e3 e4g2 e2d3 g2d5,1598,endgame equality interference short,Re3 Qg2+ Kd3 Qxd5+
0BN1T,2b2r1k/N2n1p1p/p5p1/4b3/4B3/4B3/1qPKQ1PP/3R3R w - - 0 22,d1b1 e5c3 d2d1 b2b1,1603,crushing interference middlegame short,Rb1 Bc3+ Kd1 Qxb1+
0akhe,3r3r/pp4k1/2p2pp1/5b2/1Q2N2q/P4P2/1P2K1P1/4RR2 b - - 3 35,f5e4 b4e7 g7g8 e7d8,1604,crushing interference middlegame short,Bxe4 Qe7+ Kg8 Qxd8+
0ULs9,2r3k1/pp3p1p/6pP/1n1q2P1/3Pp3/PP2Q3/3BPP2/5K1R w - - 0 30,e3f4 e4e3 h1h4 e3d2,1607,advancedpawn crushing endgame interference short,Qf4 e3 Rh4 exd2
093VW,7k/1p3r1p/2p4q/4P3/3P2p1/P2Q2P1/1PR3P1/5K2 w - - 1 34,c2f2 h6c1 f1e2 c1b2,1609,crushing endgame interference short,Rf2 Qc1+ Ke2 Qxb2+
0W0Uk,3r4/p7/5R1P/1k2P1K1/4b3/2R5/1P6/5N1r w - - 2 46,f1g3 d8g8 g5f4 h1h4 f4e3 g8g3,1613,advantage deflection endgame interference long,Ng3 Rg8+ Kf4 Rh4+ Ke3 Rxg3+
0WJBy,rk5r/pp2b1p1/4Bn1p/8/7q/1P3P2/P1Q4P/2R4K b - - 3 32,a7a5 c2c7 b8a7 c7a5,1631,equality fork interference middlegame short,a5 Qc7+ Ka7 Qxa5+
05zIn,3r3r/1p3pkp/p1pp2p1/6QP/4P1P1/1P1K1P2/2PR4/6q1 b - - 4 25,d6d5 h5h6 g7g8 g5d8,1632,endgame interference mate matein2 short,d5 h6+ Kg8 Qxd8#
0OEiy,5r2/7P/6k1/4r3/6K1/8/2R5/7R w - - 0 70,h7h8q e5g5 g4h4 f8h8,1660,endgame interference mate matein2 queenrookendgame short,h8=Q Rg5+ Kh4 Rxh8#
01mvq,4r1k1/pp3ppp/1q4b1/1Nb3B1/2Q5/2P4P/PP3PP1/R5K1 w - - 1 24,g5h4 e8e4 b5d4 e4h4,1669,crushing interference middlegame short,Bh4 Re4 Nd4 Rxh4
0S0I3,2kr1b1r/1p3ppp/p1p1pn2/8/3q4/2NPB1QP/PP3PP1/R3K2R b KQ - 2 14,d4d3 a1d1 f8d6 d1d3 d6g3 d3d8 h8d8 f2g3,1675,advantage interference middlegame verylong,Qxd3 Rd1 Bd6 Rxd3 Bxg3 Rxd8+ Rxd8 fxg3
0h2jL,4r3/ppp5/2np1Qp1/5b2/2P2k1P/3p4/PP2r1P1/R4K2 b - - 0 25,d3d2 f6g5 f4e5 f1e2,1681,advantage endgame interference short,d2 Qg5+ Ke5 Kxe2
055lF,4rrk1/1p1n2p1/p2p2p1/3P1q2/1PP1p3/5N1P/P2Q1PP1/R3R1K1 w - - 0 21,f3g5 e4e3 e1e3 f5g5,1681,advantage interference middlegame short,Ng5 e3 Rxe3 Qxg5
05uvR,2r2rk1/1p1n1ppp/p2p4/2qP3n/P7/1P1B3P/2P1N1PB/Q4R1K b - - 2 20,c5d5 f1f5 d5e6 f5h5,1682,advantage interference middlegame short,Qxd5 Rf5 Qe6 Rxh5
0Rcvr,r4r1k/pppn1pp1/3b3p/8/3P4/2N1Bq2/PPPQBPRP/7K b - - 1 18,f3h3 e2g4 h3h4 g4d7,1683,advantage interference middlegame short,Qh3 Bg4 Qh4 Bxd7
01RXs,8/8/3r3p/p1P1k3/4pp2/PPKp4/6PR/8 b - - 0 40,d3d2 h2h5 e5e6 h5h6,1687,crushing endgame interference master rookendgame short,d2 Rh5+ Ke6 Rxh6+
0EHIa,2R2R2/2p3rk/pr5p/2p1N1p1/3pP1P1/nP1P2K1/2P5/8 b - - 13 42,g7e7 f8h8 h7g7 c8g8 g7f6 h8h6 f6e5 g8g5,1697,deflection endgame interference mate matein4 verylong,Re7 Rh8+ Kg7 Rcg8+ Kf6 Rxh6+ Kxe5 Rxg5#
0AWGb,r1b2rk1/p1qn2pp/2p1pb2/3p4/8/1PN2N2/PBPQ1PPP/R3R1K1 b - - 1 14,e6e5 c3d5 c6d5 d2d5 g8h8 d5a8 c8b7 a8a7,1700,crushing fork interference master middlegame verylong,e5 Nxd5 cxd5 Qxd5+ Kh8 Qxa8 Bb7 Qxa7
03Njs,2r4r/4qp2/p1p2k2/8/4p1Q1/6R1/PP3PPP/6K1 b - - 3 32,c8g8 g4f4 f6e6 f4e4 e6d7 g3d3 d7e8 e4c6,1701,advantage deflection endgame exposedking interference verylong,Rcg8 Qf4+ Ke6 Qxe4+ Kd7 Rd3+ Ke8 Qxc6+
0DmDX,5rk1/pp3q2/3R4/6p1/2pPp3/2P1P3/PP2QP2/2K5 b - - 0 29,f7f2 d6g6 g8f7 e2f2,1706,crushing endgame interference intermezzo short,Qxf2 Rg6+ Kf7 Qxf2+
0atE3,R7/2Np1k1p/1r2p1p1/2p5/2P5/1n5P/3r1PP1/1R4K1 b - - 1 30,b6b7 c7b5 f7e7 b1b3,1706,advantage endgame interference master quietmove short,Rb7 Nb5 Ke7 Rxb3
004Ud,r1bqk2r/p3Bppp/3p4/1ppn4/4P3/4Q3/PPP2PPP/2KR1B1R b kq - 0 11,d5e7 f1b5 c8d7 d1d6 d7b5 d6d8,1708,advantage interference long middlegame,Nxe7 Bxb5+ Bd7 Rxd6 Bxb5 Rxd8+
05zrE,2r1r3/1p1q1pk1/p4n2/P2ppbN1/2n5/B1P1P2B/1P2Q3/R4KR1 b - - 1 31,c4a3 g5e6 g7h8 h3f5,1717,crushing doublecheck interference master middlegame short,Nxa3 Ne6+ Kh8 Bxf5
0XZ72,8/5p1k/5qpb/4p2p/Pp1pP3/3P4/6PP/1R2Q1K1 w - - 0 32,b1b4 h6e3 g1h1 e3d2 e1e2 d2b4,1754,crushing endgame interference long,Rxb4 Be3+ Kh1 Bd2 Qe2 Bxb4
0Fec3,r3kb1Q/pp3p1p/2p1b3/8/5P2/4B3/qPP1B1PP/2KR3R w q - 1 15,h8f6 a2a1 c1d2 f8b4 c2c3 a1b2 d2e1 b4c3 f6c3 b2c3,1760,advantage deflection fork interference middlegame verylong,Qf6 Qa1+ Kd2 Bb4+ c3 Qxb2+ Ke1 Bxc3+ Qxc3 Qxc3+
0SC89,8/3b1pk1/2p3q1/3p3p/3P3P/2P1NQb1/8/5RK1 w - - 0 34,e3f5 d7f5 f3f5 g3f2 g1f2 g6f5,1766,attraction crushing doublecheck endgame exposedking interference intermezzo long master,Nf5+ Bxf5 Qxf5 Bf2+ Kxf2 Qxf5+
0TnOF,r3k2r/p4pp1/p1Q5/2b1q3/8/6Pp/PPP2P1P/3R3K b kq - 0 21,e8e7 d1d7 e7f8 c6a8 e5e8 d7d8 f8e7 d8e8,1778,crushing endgame interference pin verylong,Ke7 Rd7+ Kf8 Qxa8+ Qe8 Rd8 Ke7 Rxe8+
0Xpoo,3r1r2/3PRp1k/6pp/ppq2p2/8/1PP2P2/1P2QKPP/3R4 w - - 2 30,f2g3 f5f4 g3f4 c5g5 f4e4 g5e7,1781,attraction crushing endgame interference long,Kg3 f4+ Kxf4 Qg5+ Ke4 Qxe7+
0Fv2T,r1bk3r/pp2q2p/2p3p1/3pb3/4p3/1P2Q3/1PPPNPPP/R1B2RK1 w - - 0 19,a1a7 d5d4 e2d4 a8a7,1785,advantage interference intermezzo middlegame short,Rxa7 d4 Nxd4 Rxa7
0ZzWr,8/2N5/2p1R1p1/1pP1P1kp/5r2/1P3pK1/rP3R1P/8 w - - 2 36,f2f3 h5h4 g3f2 a2b2 f2e3 b2b3,1786,crushing endgame exposedking interference long,Rxf3 h4+ Kf2 Rxb2+ Ke3 Rxb3+
0Zmzr,4r1k1/3q1ppp/8/p3P1N1/PpPpB3/1P2b2r/4Q1K1/4RR2 b - - 3 29,e3g5 e4f5 d7c6 g2h3,1799,advantage fork interference middlegame short,Bxg5 Bf5 Qc6+ Kxh3
0YL23,r1b1k2r/P2p1ppp/8/8/2n5/4P3/P1PNP1PP/1R2KB1R b Kkq - 0 14,c4d2 b1b8 a8a7 b8c8 e8e7 c8h8,1802,crushing interference long middlegame skewer,Nxd2 Rb8 Rxa7 Rxc8+ Ke7 Rxh8
0SUAL,8/5b2/pr6/1p1k1p2/1KpPpP2/4P3/R3B3/8 b - - 6 39,b6h6 e2c4 b5c4 a2a5 d5e6 a5a6,1817,crushing endgame interference long master sacrifice,Rh6 Bxc4+ bxc4 Ra5+ Ke6 Rxa6+
0fRhk,3rk2r/1pp1nppp/2p1b3/p7/4Pq1P/2BP1P2/P1P2QP1/RN2K2R w KQk - 3 18,c3g7 f4c1 e1e2 c1c2,1820,advantage interference middlegame short,Bxg7 Qc1+ Ke2 Qxc2+
0dacI,r6r/ppk3pp/5p2/5b2/1nP1N3/1P2P3/1P4PP/2KR1B1R w - - 2 19,e4d6 b4a2 c1d2 c7d6,1826,advantage interference middlegame short,Nd6 Na2+ Kd2 Kxd6
0TH08,2r2r1k/3nb1pp/p7/1p1Qpq2/7P/P1P1B1P1/1P3P2/2KRR3 w - - 1 22,d5d7 c8c3 b2c3 e7a3 c1d2 f5d7,1835,crushing deflection interference long master middlegame queensideattack sacrifice,Qxd7 Rxc3+ bxc3 Bxa3+ Kd2 Qxd7+
0m7R6,5rk1/ppp3pp/3p1r2/3Pp2q/2P1B3/3K2P1/PP1QRP2/5R2 w - - 18 33,f1h1 f6f3 e2e3 h5h1 e4f3 f8f3,1837,advantage interference long middlegame,Rh1 Rf3+ Re3 Qxh1 Bxf3 Rxf3
0Hvsx,1r5r/pp1qppk1/5npp/2p1P3/2B5/3P4/P1P1NPQ1/1R4K1 b - - 0 21,f6g4 e5e6 d7d6 g2g4,1845,equality interference middlegame short,Ng4 e6 Qd6 Qxg4
0eOgh,rn1q1rk1/p4p1p/3p2p1/1bp5/1pP1n3/1B2B3/PR2NPPP/3Q1RK1 b - - 0 16,b5a6 d1d5 d8e7 d5a8 a6b7 a8a7 b8c6 a7b6,1852,advantage fork interference middlegame trappedpiece verylong,Ba6 Qd5 Qe7 Qxa8 Bb7 Qxa7 Nc6 Qb6
03KsN,1r6/p4p2/2pk2p1/3p3R/2P2Q1P/3K4/Pq6/4r3 b - - 6 34,d6c5 h5d5 c6d5 f4c7 c5b4 c7b8,1853,advantage endgame interference long sacrifice,Kc5 Rxd5+ cxd5 Qc7+ Kb4 Qxb8+
00zDb,8/1pk1q3/1n3p2/2r2Pp1/p2QP2p/PB3P2/KP4P1/3R4 w - - 0 36,b3a4 c5c4 d4d3 c4a4,1862,advantage endgame interference master mastervsmaster short,Bxa4 Rc4 Qd3 Rxa4
0UdA1,r5k1/pp2Rpp1/2p5/6p1/2PP1KP1/4Q2q/PP3P2/8 w - - 0 25,f4g5 h3h6 g5f5 h6f6 f5e4 f6e7,1874,crushing endgame interference long,Kxg5 Qh6+ Kf5 Qf6+ Ke4 Qxe7+
09fPT,8/8/5np1/2Q1k2p/2K4P/8/6P1/1q6 b - - 5 51,e5f4 c5g5 f4e4 g5g6 e4e5 g6b1,1879,crushing endgame fork interference long master skewer,Kf4 Qg5+ Ke4 Qxg6+ Ke5 Qxb1
0XxwW,2kr2nr/ppp1qpp1/2p1b2p/2b1P3/2B2B2/8/PPP1QPPP/RN3RK1 w - - 3 11,b1c3 e6c4 e2c4 d8d4 c4e2 d4f4,1887,crushing interference long middlegame,Nc3 Bxc4 Qxc4 Rd4 Qe2 Rxf4
08vof,3r2k1/2q3pp/B2pp3/4np2/P1PBn3/6P1/r3PP1P/2RQ1RK1 w - - 5 21,a6b5 a2d2 d1e1 d2d4,1889,advantage interference master middlegame short,Bb5 Rd2 Qe1 Rxd4
0F2aD,2kr1b1r/p2n1ppp/8/B3N3/2BP1n2/8/P1P2PbP/RN3RK1 w - - 0 18,f1d1 d7e5 c4a6 c8b8 b1d2 d8d4,1893,advantage interference long middlegame,Rd1 Nxe5 Ba6+ Kb8 Nd2 Rxd4
04RN4,3r1r2/2pkq1bp/Q1ppb1p1/4p1P1/2N1P2P/2P1B3/1P3P2/1K1R3R b - - 2 24,d8a8 c4b6 c7b6 a6b7 d7e8 b7a8,1900,advantage interference long middlegame sacrifice,Ra8 Nb6+ cxb6 Qb7+ Ke8 Qxa8+
0ocsY,3k4/1q5p/8/4Q3/3p4/P7/1P6/K7 b - - 0 43,d4d3 e5h8 d8c7 h8h7,1906,crushing endgame interference queenendgame short,d3 Qh8+ Kc7 Qxh7+
0Qa7b,r4rk1/pp1b1p1p/3q2p1/3N4/6n1/3B1N2/PPQ2pPP/2RR1K2 w - - 2 18,d3e4 d7b5 e4d3 d6d5,1910,advantage deflection interference middlegame short,Be4 Bb5+ Bd3 Qxd5
0cEit,r3rk2/pp4b1/2pp2Q1/8/q5P1/P1P1B3/1PP2P2/2K4R b - - 0 24,a4e4 h1h8 g7h8 e3h6 f8e7 g6e4,1918,crushing exposedking interference long middlegame sacrifice,Qe4 Rh8+ Bxh8 Bh6+ Ke7 Qxe4+
0Mbgh,4r3/1pp3p1/p3p1k1/8/3pR3/5r2/PPP1KP2/7R b - - 0 33,e8f8 e4g4 g6f7 e2f3,1927,crushing endgame interference rookendgame short,Ref8 Rg4+ Kf7 Kxf3
0C50u,3rr1k1/pp2qp1p/1npR1bp1/8/4P3/1PN2NP1/P1P1QP1P/2KR4 w - - 0 19,d6d8 e7a3 c1d2 e8d8 d2e1 f6c3,1928,crushing interference intermezzo long middlegame queensideattack,Rxd8 Qa3+ Kd2 Rxd8+ Ke1 Bxc3+
0HLf3,2kr4/2pr4/1p4p1/1Q1bPpqp/3R4/1P4P1/P4P1P/3R2K1 b - - 0 26,d5c6 b5c6 d7d4 c6a8 c8d7 d1d4,1931,advantage interference intermezzo long middlegame queensideattack sacrifice,Bc6 Qxc6 Rxd4 Qa8+ Kd7 Rxd4+
0aqXg,2r2rk1/5pbp/p3q3/1p2P2R/2pPQ3/2P5/PP4PP/5RK1 b - - 4 30,h7h6 f1f6 g7f6 h5h6,1953,advantage deflection interference middlegame sacrifice short,h6 Rf6 Bxf6 Rxh6
0LqbZ,7r/r2kpQ1p/q2p2n1/2n2RP1/1pNN4/1P6/P1P1P3/1K1R4 w - - 6 32,e2e4 a6a2 b1c1 a2a1 c1d2 a1d4,1961,advantage interference long middlegame queensideattack,e4 Qxa2+ Kc1 Qa1+ Kd2 Qxd4+
0BmTF,5rk1/3p3p/2pP2B1/1r6/p2q1B1P/Pb4Q1/1P5K/2R5 b - - 0 42,d4f4 g6f7 g8f7 g3f4,1963,attraction crushing doublecheck interference intermezzo middlegame short,Qxf4 Bf7+ Kxf7 Qxf4+
0ATyq,r4rk1/1p3p2/pq4p1/6Q1/P1B3P1/2p5/2b2P1P/2R1R1K1 b - - 4 27,c2a4 e1e6 f7e6 g5g6 g8h8 g6h6,1963,crushing deflection interference long middlegame sacrifice,Bxa4 Re6 fxe6 Qxg6+ Kh8 Qh6+
01aM3,2k4r/B1p2p2/1p1b1pb1/P6p/1PB1P1P1/2P2Q1P/1q1r1PK1/R6R w - - 1 23,a5b6 d2f2 f3f2 g6e4 g2g1 b2a1,1964,advantage deflection fork interference long middlegame pin sacrifice,axb6 Rxf2+ Qxf2 Bxe4+ Kg1 Qxa1+
0ic77,8/5p2/r3p1k1/4Pp1p/5P1K/6PP/3R4/8 b - - 0 42,f7f6 d2d6 a6a8 d6e6,1968,crushing endgame interference rookendgame short,f6 Rd6 Ra8 Rxe6
